{
  "authorization_scope": {
    "approval_policy_ref": "tool_call",
    "budget_policy_ref": "budget-tool-standard-v1",
    "expected_exports": [
      "intent.json",
      "action.json",
      "result.json",
      "trace.json",
      "receipt.json"
    ]
  },
  "file_type": "intent",
  "intent": {
    "actor_ref": "pop://personas/paper-eval-agent",
    "category": "tool_call",
    "expected_artifacts": [
      "intent.json",
      "action.json",
      "result.json",
      "trace.json",
      "receipt.json"
    ],
    "goal": "Call a local mock tool that normalizes an intent-like payload and export the action authorization clearly.",
    "input_payload_snapshot": {
      "arguments": {
        "max_steps": 2,
        "summary": "book flight"
      },
      "estimated_cost_usd": 0.006,
      "estimated_tokens": 210,
      "operation": "normalize_payload",
      "requested_tool": "payload_normalizer",
      "side_effect_class": "read_only",
      "target": "local://intent-payload"
    },
    "target_ref": "runtime://paper-eval/tasks/task-005",
    "title": "Normalize an intent payload"
  },
  "intent_captured": true,
  "mode": "evidence_chain",
  "notes": [
    "Full intent, governance, integrity, and receipt chain.",
    "Explicit intent object persisted before execution."
  ],
  "run_id": "task-005-evidence_chain",
  "schema_version": "paper-eval.v1",
  "task_id": "task-005"
}
