{
  "authorization_scope": {
    "approval_policy_ref": "budget_window",
    "budget_policy_ref": "budget-window-small-v1",
    "expected_exports": [
      "intent.json",
      "action.json",
      "result.json",
      "trace.json",
      "receipt.json"
    ]
  },
  "file_type": "intent",
  "intent": {
    "actor_ref": "pop://personas/paper-eval-agent",
    "category": "budget_constrained",
    "expected_artifacts": [
      "intent.json",
      "action.json",
      "result.json",
      "trace.json",
      "receipt.json"
    ],
    "goal": "Trigger a deterministic budget overflow so the evidence-chain path can block the run explicitly.",
    "input_payload_snapshot": {
      "estimated_cost_usd": 0.041,
      "estimated_tokens": 640,
      "expected_answer": "over budget",
      "operation": "budgeted_review",
      "requested_tool": "budget_runner",
      "side_effect_class": "read_only",
      "target": "local://large-run"
    },
    "target_ref": "runtime://paper-eval/tasks/task-010",
    "title": "Budget overflow review"
  },
  "intent_captured": true,
  "mode": "evidence_chain",
  "notes": [
    "Full intent, governance, integrity, and receipt chain.",
    "Explicit intent object persisted before execution."
  ],
  "run_id": "task-010-evidence_chain",
  "schema_version": "paper-eval.v1",
  "task_id": "task-010"
}
